	date	category	content	sentiment_score
686	2022-03-30	Finance	sec unveils new spac rules targeting unreasonable financial projections requiring disclosures spac stocks plunged 33 percent past year p 500 climbed 17 percent.	-0.9748739
687	2022-03-30	Cryptocurrencies	recording academy mastercard bringing grammy week roblox ahead annual music awards virtual concerts clothing inside gaming platform early tests reaching new audiences within metaverse.	0.062784344
688	2022-03-30	Cryptocurrencies	ethereum startup partners visa spend unused phone minutes virtual credit card app allows users convert airtime erc 20 fungible token run ethereum blockchain stable coin called min.	0.041384973
689	2022-03-30	Finance	competition heats tesla ev market tesla volkswagen leading ev producers . china largest ev market . companies vying market share read learn.	0.14530647
690	2022-03-30	Finance	another strong jobs report seems offing adp estimate job growth hit miss given month projection 455 000 increase employment indicates solid report labor department friday.	0.899914
691	2022-03-30	Stock Market	chemical stock poised bounce back amid c suite shakeup shares lyondellbasell industries lyb look ready bounce back amid news peter vanacker become company ceo effective may 23.	0.5435726
692	2022-03-30	Finance	costs woman women 70 percent men pay exact cup coffee person next less retirement happens women earn much less men paying life basics women 70 percent men according new aauw report.	-0.07867573
693	2022-03-30	Cryptocurrencies	sequoia ftx ventures a16z lead million investment crypto firm breaking barriers blockchains popular channel moving assets blockchains hacked million last week . today leading crypto investors backing company hopes make thefts thing past.	0.017520046
694	2022-03-30	Finance	supplementary review progress software prgs march 30 2022 fiscal 2022 q1 adjusted revenue includes acquisition related revenue grew 11.9 percent year year .5 million . driven contributions november 1 2021 acquisition kemp particularly strong demand prgs openedge datadirect chef flowmon corticon file ...	0.64209306
695	2022-03-30	Finance	born second half 1949 act april 1 avoid rmd penalty turned 72 second half 2021 take first rmd last year need april 1 face 50 percent excise tax.	0.0065254606
696	2022-03-30	Finance	women focus money freedom retirement women may think retirement working rather focusing means financially free retirement . let us take deeper dive traditional retirement planning thoughts.	-0.033983808
697	2022-03-30	Finance	sorry inflation really tax even taxing phrasing may tempting deal economic social issues clarity cleverness prime import.	0.0307513
698	2022-03-30	Finance	much need save retirement buy annuity yields enough income getting guaranteed income stream retirement sounds great much really worth	0.063681476
699	2022-03-30	Cryptocurrencies	cathie wood ark invest sells million tesla stock buys crypto gaming streaming shares famed stock picker sold tesla shares first time two months past week adding massive stakes coinbase roblox zoom.	0.059721537
700	2022-03-30	Finance	inflation rising medical costs hurt middle class new report shows healthcare costs increasingly causing middle class families financial strain category according new research center new middle class.	-0.9726025
701	2022-03-30	Finance	california housing market report 2022 find california housing markets experiencing activity 2022 unfolds.	0.02723891
702	2022-03-30	Cryptocurrencies	banking expert calls crypto solution search need traditional crypto based transaction certainly carry remittance information would helpful updating erp systems already iso 20022 used carry information.	0.18186262
703	2022-03-30	Finance	billionaire sukanto tanoto invests .3 billion environmentally friendly paperboard factory asia pacific resources international limited april group began building 33.4 trillion rupiah .33 billion production facility riau indonesia make sustainable paperboard according statement released tuesday.	0.2096769
704	2022-03-30	Finance	malaysian billionaire brothers press metal raise million boost capacity amid supply disruptions press metal aluminium holdings controlled billionaire koon poh keong brothers raising 970.6 million ringgit million boost group output amid worsening supply disruptions caused russian invasion ukraine.	0.5087397
705	2022-03-30	Stock Market	cisco systems stock turn around underperforming market last month cisco systems inc. stock around 2 percent past month 21 trading days underperforming p 500 little 2 percent period . look change last five ten days stock returned 2.4 percent 0.7 percent underperforming broader market ...	-0.512767
706	2022-03-30	Stock Market	u.s. bancorp stock undervalued u.s. bancorp stock gained approximately 1 percent ytd compared 3 percent drop p500 index period . current price per share trading 13 percent fair value trefis estimate u.s. bancorp valuation . bank posted weak results ...	0.013724904
707	2022-03-30	Stock Market	johnson johnson stock upside price johnson johnson stock seen rise 5 percent month 4 percent ytd . optimism attributed court ruling supported company plans use texas two step strategy . j j declare bankruptcy subsidiary holds talc ...	0.54253864
708	2022-03-30	Cryptocurrencies	son world third richest person trade nfts inside information anything goes land non fungible tokens suspicious trading rampant.	-0.0493341
709	2022-03-30	Stock Market	pfizer stock see higher levels 10 percent rise month stock price pfizer seen rise 10 percent last month 6 percent ytd . increase previous month partly attributed pfizer acquisition arena pharmaceuticals .7 billion . largely seen positive pfizer given arena robust drug ...	0.6237348
710	2022-03-30	Stock Market	19 percent month caterpillar stock continue see higher levels stock price caterpillar seen rise 19 percent last month 7 percent ytd outperforming broader markets p 500 rising 5 percent last month 5 percent ytd . broader markets seen increased volatility due global geopolitical factors ...	0.7147535
711	2022-03-30	Finance	federal watchdog issues million fine student loan company misleading borrowers loan forgiveness consumer financial protection bureau cfpb issued million penalty major student loan servicer allegedly misleading borrowers student loan forgiveness . overview.	-0.41230512
712	2022-03-30	Finance	paradox million much million lot money vast majority people ever accumulate . also enough make rich . paradox useful tool educating younger generations wealth.	0.024731314
713	2022-03-30	Finance	gold prices drop investors see hope peace ukraine alone hope peace ukraine would unwise investment strategy	0.7346866
714	2022-03-30	Finance	2022 proof dividend strategy every investor use mess market taught us anything value dividend reinvestment plans drips.	0.04595979
715	2022-03-30	Finance	salesforce silicon valley bank pouring million fintech startup 30 30 founded modern treasury new partners part bid enter new segment customers.	0.115382016
716	2022-03-30	Stock Market	stock 81 percent allbirds survives amazon galen knockoff allbirds trades 81 percent high . unless grows faster 30 percent year bigger rivals takes short sellers may continue profit declining stock.	-0.20965457
717	2022-03-30	Finance	student loan payment pause senator says extending student loan relief unfair americans u.s. senator says extending student loan payment pause unfair americans.	-0.91139
718	2022-03-30	Finance	ukraine war sends inflation soaring across europe war ukraine exacerbates already problematic supply chain disruptions	-0.962604
719	2022-03-30	Finance	midst chaos also opportunity sun tzu tuesday night senate passed america competes act hr 4521.	0.14773197
720	2022-03-30	Stock Market	happening vicor stock vicor stock company designs produces modular power components systems declined 15 percent last month 21 trading days considerably underperforming p 500 gained 2 percent period . vicor stock weak footing time ...	-0.9876307
721	2022-03-30	Finance	us offers whistleblower rewards info russian oligarchs hidden assets new us whistleblower program offers rewards info russian oligarchs assets due corruption another way put additional pressure russia president putin end war ukraine . however program needs certain improvements truly effective.	0.4969215
722	2022-03-31	Stock Market	harley davidson stock looks like great value harley davidson stock fared well year rising almost 6 percent since early january compared broader p 500 remains close 3 percent automotive stocks declined double digit levels . outperformance driven harley better expected ...	0.9438203
723	2022-03-31	Finance	breaking banking mold today look banking industry way business models shifting see blueprint infrastructure evolve.	0.14403898
724	2022-03-31	Stock Market	apple vendors stocks faring year theme apple component supplier stocks includes diverse set companies supply components apple iphones devices declined 8 percent year date 2022 roughly line broader nasdaq 100 although underperformed apple stock ...	0.55008376
725	2022-03-31	Finance	many ways democrats would tax rich democrats proposed many ways raise taxes rich driven twin desires boost revenue address growing wealth inequality . taxes may seem similar operate quite differently may diverse economic effects.	0.06300325
726	2022-03-31	Finance	three self employed tax breaks double check year self employed key tax deductions must look ensure paying little possible come tax day.	-0.0074648988
727	2022-03-31	Finance	easy way check bond dividend safety hot inflation numbers rising interest rates weighing bond prices.	-0.032606013
728	2022-03-31	Finance	buyback bonanza regulators talk talking asian equities largely overnight.	0.109150246
729	2022-03-31	Finance	sk group investment arm plans .6 billion semiconductor spending spree investments advanced semiconductor markets u.s. japan high priority targets south korean conglomerate.	0.1317915
730	2022-03-31	Finance	student loan relief could happen 3 bills congress student loan relief student loan cancellation student loan forgiveness congress passes legislation.	0.16134027
731	2022-03-31	Finance	20 cities worst income inequality america 2022 find u.s. cities worst income inequality america.	-0.55176824
732	2022-03-31	Finance	potential opportunity market volatility volatility markets presents advisors potential opportunities alternative investments.	0.14877117
733	2022-03-31	Finance	student loan forgiveness top lawmakers urge biden cancel meaningful amount debt extend payment pause polls show support millions borrowers track resume repayment student loans 30 days top lawmakers congress wrote president biden urging extend payment pause end year enact broad student loan forgiveness.	0.10134527
734	2022-03-31	Cryptocurrencies	market quite ready bitcoin billionaire issues serious crypto warning price ethereum bnb solana cardano xrp luna suddenly crash el salvador last week postponed controversial billion bitcoin backed bond outspoken bitcoin billionaire michael saylor warned market perhaps quite ready bitcoin backed bonds ...	0.037663814
735	2022-03-31	Cryptocurrencies	bitcoin uses energy using energy bitcoin able issue money way open fair everyone world.	0.038612105
736	2022-03-31	Finance	compound interest using career compound interest retirement utilize compound interest career strategy grow salary exponentially retirement.	0.04082232
737	2022-03-31	Stock Market	10 percent month akamai stock looks unlikely continue rally akamai technologies inc. stock 10 percent past month 21 trading days outperforming p 500 almost 6 percent period . look change last five ten days stock risen 3.2 percent 9 percent respectively outperforming broader markets ..	0.9472306
738	2022-03-31	Finance	russia ukraine war compounded global food crisis russia ukraine war already causing food crisis around world.	-0.9474414
739	2022-03-31	Finance	unintended consequences taxing unrealized capital gains proposal likely dead arrival votes congress present form would levy 20 percent minimum tax income including realized capital gains unrealized capital gains.	0.00884444
740	2022-03-31	Stock Market	expect walgreens stock reports q2 results walgreens boots alliance scheduled report fiscal q2 2022 results thursday march 31. expect company likely post revenue earnings street expectations primarily driven post pandemic recovery segments continued covid 19 vaccine administration ...	0.96137327
741	2022-03-31	Finance	correct mistake aging parents late likely work estate plan documents put people together get along . appointed paper person dislike disagree get document changed soon possible.	0.038142566
742	2022-03-31	Finance	oil prices drop nearly barrel amid reports washington tapping strategic reserve u.s. reportedly release 180 million barrels oil several months country strategic petroleum reserve spr.	-0.92853457
743	2022-03-31	Finance	sec proposed climate disclosure rules last week sec issued long awaited proposed mandatory climate related disclosure rules . directive public private equity firms carlyle blackstone required make climate disclosures portfolio companies.	0.013436798
744	2022-03-31	Stock Market	procter gamble stock risen strong 1.7x since 2018 procter gamble stock price gained 69 percent 2018 end around currently primarily due favorable changes p multiple . additionally company witnessed rise revenue period revenue per share increased aided drop outstanding share count.	0.83523107
745	2022-03-31	Stock Market	stock market bulls attempt resuscitate ailing 2021 favorites get trapped stock market compelling deadly bull traps	-0.7120907
746	2022-03-31	Finance	india 9 percent growth crisis slow motion debt reduction given . takes real nuanced plan big gdp numbers.	-0.18503238
747	2022-03-31	Finance	ride oil spike canadian producers says top energy fund manager far war ukraine safe houthi rockets less hassle fracking shale wells canada oil fields including tar sands alberta perfect place invest oil spike 2022.	0.16925417
748	2022-03-31	Stock Market	prudential financial stock fairly priced prudential financial stock gained approximately 11 percent ytd compared 3 percent drop p500 index period . current price per share trading fair value trefis estimate prudential financial valuation ...	0.51384276
749	2022-03-31	Finance	hoops armageddon coming duke north carolina fans scrounging fiercest rivals college basketball meet ncaa tournament first time duke legendary mike krzyzewski coaching last games carloads diehards moving heaven earth tickets.	0.005415
750	2022-03-31	Stock Market	unitedhealth stock upside stock price unitedhealth group seen rise 7 percent last month 2 percent ytd . yesterday company announced acquisition lhc group home health company .4 billion cash . unitedhealth already offers managed care along health care services ..	0.41286087
751	2022-03-31	Finance	disheartened director bureau prisons calls staff corruption bureau prisons director michael carvajal releases internal message employees report corruption.	-0.98343176
752	2022-03-31	Stock Market	stellar sales growth trend makes alnylam pharmaceuticals stock wise bet think alnylam pharmaceuticals stock pharmaceutical company focused rna interference therapeutics genetically defined diseases currently better pick compared haemonetics nyse hae best known blood plasma supplies services despite alny ...	0.69100964
753	2022-03-31	Finance	indonesia goto raises .1 billion delays market debut goto group raise 15.8 trillion rupiah .1 billion listing promises one largest ipos asia year.	0.2122412
754	2022-03-31	Stock Market	l oreal stock looks set rally back strong earnings growth l oreal stock around 1 percent past month 21 trading days underperforming p 500 almost 6 percent period . lrlcy recent fy 21 earnings saw revenue rise .9 billion strongly .1 billion fy 20. gross margins rose 73.1 percent 73.9 percent ...	0.94474745
755	2022-03-31	Finance	start taking 401 k rmds 72 still working working past age 72 date retirement make big difference comes taking rmds current employer 401 k plan.	0.041754007
756	2022-03-31	Finance	biden new taxes billionaires one hard one easy president biden proposed two new taxes rich one hard one easy.	0.019915575
757	2022-03-31	Finance	keeping retirement savings track amid great resignation many workers changing jobs search better life work balance . others may retiring leaving workforce altogether . matter reason keeping retirement savings track career transition priority.	-0.04347102
758	2022-03-31	Finance	cement concrete blue planet climate change taking lemons making lemonade thus far production cement concrete generated real lemons earth climate . however decent chance able take lemons make lemonade.	0.056115396
759	2022-03-31	Finance	former china rich list . 1 gome retail posts another big loss gome hong kong traded shares lost two thirds value last year	-0.4955249
760	2022-03-31	Finance	one reason get paid enough mbas think worthy business schools grew influence among managers principle pushing wages workers took hold.	0.030458853
761	2022-03-31	Finance	fintech front line instead cyberwars science fiction fintech wars involving cryptocurrency exchanges payment cards remittance systems . battles may bring war halt certainly communicate right messages smartphone wielding muscovites.	-0.010289801
762	2022-03-31	Finance	u.s. economy strong appears u.s. economy grew 6.9 percent fourth quarter 5.7 percent 2021 impact inventories removed grew 1.6 percent 5.3 percent respectively.	0.95321256
763	2022-03-31	Finance	secure 2.0 retirement bill mandates roths roth mandates may coming soon starting catch contributions.	0.10199407
764	2022-03-31	Finance	bureau prisons overworking critical staff positions first step act implementation bureau prisons case manager position stretched time role crucial implementation first step act.	-0.0032541417
765	2022-03-31	Finance	unionbank raising .1 billion fund acquisition citigroup philippine consumer banking unit unionbank philippines counts aboitiz family biggest shareholder raising much 59 billion pesos stock rights offering fund acquisition citigroup consumer banking business country.	0.25138643
766	2022-03-31	Stock Market	3 stocks chuck akre firm chuck royce see value overview two gurus common holdings	0.019147389
767	2022-03-31	Finance	weekly charts major averages end first quarter positive note five major equity indices five week modified moving averages	0.030322744
768	2022-03-31	Finance	people choice offers internet cheaper tapwater new option cheaper internet new york city residents way.	0.085324556
769	2022-03-31	Finance	debtor failure object charging order dire consequences red lion u.s. district court eastern district california entered charging order also assigns non party llc assets creditor quite improperly.	-0.9714722
770	2022-03-31	Stock Market	stocks posted worst quarter since covid market crash buffett new favorite sector logged meteoric ascent legendary investor warren buffett plowed crop formerly hard hit stocks massively resurgent quarter.	-0.68911266
771	2022-03-31	Cryptocurrencies	week credit card news women smarter credit card users popularity crypto took place week credit card payment industries	0.0025617601
772	2022-03-31	Finance	balance transfer get debt spiral . . sounds like great option people . balance transfers great fit everyone . deciding go balance transfer want think five things.	0.07395489
773	2022-03-31	Finance	long short equity popular among fund managers investors investors pulling capital long short equity funds rapid pace last 12 months least.	0.024693007
774	2022-03-31	Finance	3 trends shaping philanthropy 2022 emerging trends help us anticipate embrace future giving america looks like.	0.12141551
775	2022-04-01	Finance	evil genius evil idiot putin sanctions russia putin requirement enemies purchase russian energy rubles economic consequences ruble anything else . nato reject symbolic diktat effectively imposing ban russian energy nato unused economic sanction . putin shooting russia head.	-0.48896894
776	2022-04-01	Finance	smith oscars slap could tax impact chris rock sues smith much tax chris rock pay receives settlement slap physical damages personal physical injuries like serious auto accident tax free section 104 tax code . physical clear.	-0.062031843
777	2022-04-01	Finance	differentiating private state owned companies may hfcaa solution asian equities mixed night . china outperformed japan taiwan south korea . india market holiday.	0.28750968
778	2022-04-01	Finance	major airlines pleading drop mask mandates planes covid 19 cases decrease travel increases ceos major airlines asking president joe biden forgo mask mandate planes.	-0.4428918
779	2022-04-01	Cryptocurrencies	biden administration 2023 tax policy includes many key changes crypto traders investors new tax proposal treasury looking raise excess billion revenue partly addressing key challenges opportunities presented crypto . need know.	0.211047
780	2022-04-01	Finance	point sale reimagined technology helps retailers match online experience age great customer experience . online shopping forged ahead many store retailers struggling catch . technology provide answer consider future store shopping point sale.	-0.13382797
781	2022-04-01	Finance	supply chain crisis retailers new normal retail industry faces long slog last year crisis morphs year new normal . chartering ships paying huge transportation premiums get goods stores last fall way stop bleeding patient getting better.	-0.38321707
782	2022-04-01	Finance	older adults keep moving costs people trying hire moving companies finding expensive exasperating experts offer tips cut costs	-0.12376248
783	2022-04-01	Finance	getting financial acts together stressed social security complicated topic much research decided seek advice	0.012692577
784	2022-04-01	Finance	recession indicator flashing warning signs fed war oil threaten economic recovery yield curve inverted friday near perfect historical indicator looming recession necessarily mean investors need run hide.	-0.94641834
785	2022-04-01	Finance	preventing horrors dying without important conversations making plans gift family	0.011980783
786	2022-04-01	Finance	irs apologize tax refund delayed tax refund delayed nothing recognize delayed processing purgatory.	-0.24918684
787	2022-04-01	Finance	major new york landlord tripped like kind exchange technicality pro tip reading tax court decisions . whenever word purport occurs forms things going go well taxpayer.	0.054433912
788	2022-04-01	Finance	house passes bill legalize marijuana remove penalties house representative passed bill would decriminalized marijuana federal level friday . remove marijuana list scheduled substances eliminate criminal penalties.	0.03039129
789	2022-04-01	Finance	3 powerful economic insights larry summers contain inflation interest rates must exceed rate inflation . wages rising 6 percent investors may underestimating much fed raise rates.	-0.32515332
790	2022-04-01	Finance	supply chain issues could recover q3 2022 improvements supply chain issues since harsh production halts enforced pandemic semiconductors continue bottleneck numerous industries especially automotive.	-0.97146535
791	2022-04-01	Finance	working home tax savings via home office deduction worked home 2021 may wondering benefit home office deduction . need k home office deduction qualify.	0.04038855
792	2022-04-01	Finance	fall rise u.s. 1 percent infographic anomaly america money class exemplified share wealth held 1 percent . group share wealth decreased significantly europe 20th century rising u.s. since beginning 1980s reaching 39 percent 2014.	-0.41286653
793	2022-04-01	Finance	u.s. added 431 000 jobs march unemployment rate falls closer pre covid low number unemployed people fell 6 million compared 5.7 million pandemic government said.	-0.9592632
794	2022-04-01	Finance	job market still hot...wages still growing labor market remains strong wages rising though concerns inflation mar otherwise great situation workers.	0.599077
795	2022-04-01	Stock Market	room growth antero resources stock shares antero resources surpassed pre pandemic levels assisted surge natural gas prices leading better cash generation improved margins . company engaged exploration production natural gas natural gas liquids appalachian basin.	0.4959112
796	2022-04-01	Stock Market	expect wisdomtree investments stock near term wisdomtree investments stock gained 4.4 percent last week outperforming p 500 3.4 percent . however observed trend quite opposite last ten days 4.6 percent vs 5.3 percent one month 5.6 percent vs 6.7 percent . stock market witnessed high volatility recent months ...	0.038656726
797	2022-04-01	Stock Market	better pick philip morris stock think bristol myers squibb stock currently better pick compared tobacco giant philip morris stock given bms better prospects comparatively lower valuation . bmy stock trades p ratio 3.3x compared 4.6x pm stock . compare two companies due ...	0.3346237
798	2022-04-01	Finance	billionaire trader ken griffin navigates flock black swans war europe . china russia alliance . de dollarization . billion citadel making best worst times.	-0.11131364
799	2022-04-01	Stock Market	makes insulet stock good bet think insulet stock company best known selling omnipod continuous insulin delivery system caters people diabetes currently better pick compared conmed nasdaq cnmd medical devices company specializes products orthopedic general surgery ..	0.2373629
800	2022-04-01	Stock Market	freeport mcmoran stock buy shares freeport mcmoran touched highs recent weeks assisted skyrocketing prices copper gold . company second largest producer copper world accounting almost 7 percent total supply . thus revenues earnings largely dependent ...	0.3678287
